{"$id":"knowledge-engine-m25-9a-run-evidence/v1","$schema":"https://json-schema.org/draft/2020-12/schema","additionalProperties":false,"properties":{"authority":{"$id":"knowledge-engine-m25-9-inventory-authority/v1","$schema":"https://json-schema.org/draft/2020-12/schema","additionalProperties":false,"properties":{"actor":{"pattern":"^[A-Za-z0-9._@-]{3,128}$","type":"string"},"actor_role":{"const":"knowledge_owner"},"authority_comment_id":{"minimum":1,"type":"integer"},"authority_sha256":{"pattern":"^[0-9a-f]{64}$","type":"string"},"inventory_approved":{"const":true},"inventory_sha256":{"pattern":"^[0-9a-f]{64}$","type":"string"},"large_scale_ingestion_authorized":{"const":false},"m25_9b_authorized":{"const":false},"m25_9c_authorized":{"const":false},"max_cost_usd":{"minimum":0,"type":"number"},"mode":{"enum":["live","test_only"]},"pilot_start_authorized":{"const":true},"production_pointer_authorized":{"const":false},"production_release_authorized":{"const":false},"provider_calls_authorized":{"type":"boolean"},"schema_version":{"const":"knowledge-engine-m25-9-inventory-authority/v1"},"source_count":{"maximum":100,"minimum":50,"type":"integer"},"stop_thresholds":{"additionalProperties":false,"properties":{"max_failed_sources":{"minimum":0,"type":"integer"},"max_security_failures":{"const":0},"max_unaccounted_sources":{"const":0}},"required":["max_failed_sources","max_unaccounted_sources","max_security_failures"],"type":"object"}},"required":["schema_version","mode","actor","actor_role","authority_comment_id","inventory_sha256","source_count","inventory_approved","pilot_start_authorized","provider_calls_authorized","max_cost_usd","stop_thresholds","production_pointer_authorized","production_release_authorized","large_scale_ingestion_authorized","m25_9b_authorized","m25_9c_authorized","authority_sha256"],"type":"object"},"boundary":{"additionalProperties":false,"properties":{"benchmark_fixture_adopted":{"const":false},"candidate_deployment":{"const":false},"credential_mutation":{"const":false},"m25_10_authorized":{"const":false},"m25_9b_authorized":{"const":false},"m25_9c_authorized":{"const":false},"production_pointer_mutation":{"const":false},"production_release_mutation":{"const":false},"qdrant_mutation":{"const":false},"r2_production_mutation":{"const":false},"source_merge":{"const":false},"source_write":{"const":false},"traffic_mutation":{"const":false}},"required":["benchmark_fixture_adopted","source_write","source_merge","candidate_deployment","qdrant_mutation","r2_production_mutation","production_release_mutation","production_pointer_mutation","traffic_mutation","credential_mutation","m25_9b_authorized","m25_9c_authorized","m25_10_authorized"],"type":"object"},"candidate_population":{"additionalProperties":false,"properties":{"candidate_count":{"minimum":0,"type":"integer"},"candidate_ids_sha256":{"pattern":"^[0-9a-f]{64}$","type":"string"},"candidate_packet_sha256":{"pattern":"^[0-9a-f]{64}$","type":"string"}},"required":["candidate_count","candidate_packet_sha256","candidate_ids_sha256"],"type":"object"},"evidence_sha256":{"pattern":"^[0-9a-f]{64}$","type":"string"},"execution":{"additionalProperties":false,"properties":{"run_id":{"maxLength":128,"minLength":1,"type":"string"},"runner_sha":{"pattern":"^[0-9a-f]{40}$","type":"string"},"stages":{"items":{"additionalProperties":false,"properties":{"checkpoint_sha256":{"pattern":"^[0-9a-f]{64}$","type":"string"},"stage":{"enum":["dry_run_inventory_policy_validation","immutable_acquisition","normalization","extraction","identity_resolution","relation_tag_governance","candidate_packaging"]},"status":{"const":"pass"}},"required":["stage","status","checkpoint_sha256"],"type":"object"},"maxItems":7,"minItems":7,"type":"array"}},"required":["run_id","runner_sha","stages"],"type":"object"},"failure_drills":{"items":{"additionalProperties":false,"properties":{"drill":{"enum":["interrupted_acquisition","provider_timeout","invalid_model_json","stale_checkpoint","source_base_drift","duplicate_path_collision","incomplete_review","failed_source_ci","failed_release_rebuild","candidate_rollback","access_security_regression"]},"evidence_sha256":{"pattern":"^[0-9a-f]{64}$","type":"string"},"status":{"const":"pass"}},"required":["drill","status","evidence_sha256"],"type":"object"},"maxItems":11,"minItems":11,"type":"array"},"inventory_ref":{"additionalProperties":false,"properties":{"inventory_sha256":{"pattern":"^[0-9a-f]{64}$","type":"string"},"source_count":{"maximum":100,"minimum":50,"type":"integer"},"source_ids_sha256":{"pattern":"^[0-9a-f]{64}$","type":"string"}},"required":["inventory_sha256","source_count","source_ids_sha256"],"type":"object"},"metrics":{"additionalProperties":false,"properties":{"candidate_count":{"minimum":0,"type":"integer"},"cost_usd":{"minimum":0,"type":"number"},"p50_source_latency_ms":{"minimum":1,"type":"integer"},"p95_source_latency_ms":{"minimum":1,"type":"integer"},"reviewer_minutes":{"minimum":0,"type":"integer"},"security_failures":{"const":0},"source_count":{"maximum":100,"minimum":50,"type":"integer"},"unaccounted_sources":{"const":0},"wall_clock_ms":{"minimum":1,"type":"integer"}},"required":["cost_usd","wall_clock_ms","p50_source_latency_ms","p95_source_latency_ms","source_count","candidate_count","reviewer_minutes","security_failures","unaccounted_sources"],"type":"object"},"mode":{"enum":["live","test_only"]},"population":{"items":{"additionalProperties":false,"properties":{"candidate_count":{"minimum":0,"type":"integer"},"source_id":{"type":"string"},"source_receipt_sha256":{"pattern":"^[0-9a-f]{64}$","type":"string"},"terminal_state":{"enum":["candidate_ready","no_new_knowledge","rejected_policy","rejected_unsupported","deferred_ambiguity","deferred_contradiction","failed_technical","cancelled_by_operator"]}},"required":["source_id","terminal_state","candidate_count","source_receipt_sha256"],"type":"object"},"maxItems":100,"minItems":50,"type":"array"},"predecessor":{"additionalProperties":false,"properties":{"engine_merge_sha":{"pattern":"^[0-9a-f]{40}$","type":"string"},"evidence_sha256":{"pattern":"^[0-9a-f]{64}$","type":"string"},"production_pointer_unchanged":{"const":true},"production_release_unchanged":{"const":true},"status":{"enum":["m25_8_adoption_release_rollback_complete","m25_8_test_only_adoption_simulation_passed"]}},"required":["status","engine_merge_sha","evidence_sha256","production_pointer_unchanged","production_release_unchanged"],"type":"object"},"schema_version":{"const":"knowledge-engine-m25-9a-run-evidence/v1"}},"required":["schema_version","mode","predecessor","inventory_ref","authority","execution","population","candidate_population","metrics","failure_drills","boundary","evidence_sha256"],"type":"object"}
