{"authority":{"actor":"synthetic-knowledge-owner","actor_role":"knowledge_owner","authority_comment_id":9009,"authority_sha256":"f73b4d1e9bbf3285c70e0646bcde25724b7ea5779460258e641d41138be90697","inventory_approved":true,"inventory_sha256":"876e5f216adf7cdd3cc57cbdfd0a4335d13278953bab0238e1b9d769f7c8dc90","large_scale_ingestion_authorized":false,"m25_9b_authorized":false,"m25_9c_authorized":false,"max_cost_usd":25.0,"mode":"test_only","pilot_start_authorized":true,"production_pointer_authorized":false,"production_release_authorized":false,"provider_calls_authorized":false,"schema_version":"knowledge-engine-m25-9-inventory-authority/v1","source_count":50,"stop_thresholds":{"max_failed_sources":2,"max_security_failures":0,"max_unaccounted_sources":0}},"boundary":{"benchmark_fixture_adopted":false,"candidate_deployment":false,"credential_mutation":false,"m25_10_authorized":false,"m25_9b_authorized":false,"m25_9c_authorized":false,"production_pointer_mutation":false,"production_release_mutation":false,"qdrant_mutation":false,"r2_production_mutation":false,"source_merge":false,"source_write":false,"traffic_mutation":false},"candidate_population":{"candidate_count":90,"candidate_ids_sha256":"14f7390fb42c64be267b8611ee17ded25d801d73536234ddc0eb0c882ec1bc2e","candidate_packet_sha256":"389453f1b4cbd8679fe7210faf6eb07ce4f49490b0b751b7ca533dfaa37e3fbd"},"evidence_sha256":"65a0d930b7eb9eb0a994de7b859ef8881b3b7e249e8724eb23bae6e41f40b6db","execution":{"run_id":"m25-9a-synthetic-run-001","runner_sha":"aaaaaaaaaaaaaaaaaaaaaaaaaaaaaaaaaaaaaaaa","stages":[{"checkpoint_sha256":"e4d2b37f7cb534fa12fb8a7f129c9dfff5a402f3df5e89ce49db68cd403da6ea","stage":"dry_run_inventory_policy_validation","status":"pass"},{"checkpoint_sha256":"4bc9cea0e5c5264824d4adb8a4938b280939f1b646d21d94044ccdaae8551d24","stage":"immutable_acquisition","status":"pass"},{"checkpoint_sha256":"c498d159c617a9da38bbdf147d1aeb0396fc80c94651dd591683650512f88f52","stage":"normalization","status":"pass"},{"checkpoint_sha256":"85aa3fdb828ee35bbc4d91a384b855a7bc5e450d29387b08534a3bd8e631c720","stage":"extraction","status":"pass"},{"checkpoint_sha256":"7ed36dec48fd95d21341c2a52ddafc156a1623b50b9cd9e941224344cff403ae","stage":"identity_resolution","status":"pass"},{"checkpoint_sha256":"95c17212930aa99e02c9177ebc16cc653b227d95ce3946e374aa0358d67d91cb","stage":"relation_tag_governance","status":"pass"},{"checkpoint_sha256":"912c1626bc574ee1921fc0f0c13b8428b14c3ff20dfdd09ec534ab9a76bffc82","stage":"candidate_packaging","status":"pass"}]},"failure_drills":[{"drill":"interrupted_acquisition","evidence_sha256":"373242a24f4f5bec65991c0cc500d3eee5a59558c4328484c003a61dece2bc96","status":"pass"},{"drill":"provider_timeout","evidence_sha256":"82276ed22a2280dc0c5cc55865c3103071e85a1d12fab8a76016411fef244bf1","status":"pass"},{"drill":"invalid_model_json","evidence_sha256":"f96f6017736c2c1d7d67ace4ef6025c6dc27a335e099fc6f876aa479b45b7119","status":"pass"},{"drill":"stale_checkpoint","evidence_sha256":"e9db2b1f7f37e8cb1becfe577e742bd2cf8b04d3fbb35518a97bab371b2150bd","status":"pass"},{"drill":"source_base_drift","evidence_sha256":"a61e9ca192a03e07f74751dee8d5b30e600c2beae996db53476aed75b7609eba","status":"pass"},{"drill":"duplicate_path_collision","evidence_sha256":"44cd7a082a2a96c25d69ed96d30ed7fe999d3b6580352c5b33b23d593397e2e0","status":"pass"},{"drill":"incomplete_review","evidence_sha256":"f23e1fbfc1cb6add98fbe56d506501d689c74cc83220688a564363e56926a7e0","status":"pass"},{"drill":"failed_source_ci","evidence_sha256":"0bf59e86b7850c61ebfe85068df3a6cde890a77ca3a92eaeda820489089aa14a","status":"pass"},{"drill":"failed_release_rebuild","evidence_sha256":"a97dcc05cf3029836a6014e8d6b70d07ba37fb49dd8ca6ee93fae1229a2686ba","status":"pass"},{"drill":"candidate_rollback","evidence_sha256":"d71731307640c8a213d044a9733e8a7b25005a90f34b9ffab09df1ac580d0368","status":"pass"},{"drill":"access_security_regression","evidence_sha256":"098d5804c6d7c6255eb9b62d3ddfbfb91aafd6c919eb387824325c4013de0c7f","status":"pass"}],"inventory_ref":{"inventory_sha256":"876e5f216adf7cdd3cc57cbdfd0a4335d13278953bab0238e1b9d769f7c8dc90","source_count":50,"source_ids_sha256":"98f36d1675a89105f01b713dcb58c16a8e14e13c3d26ff36f47ace7980272ea1"},"metrics":{"candidate_count":90,"cost_usd":0.0,"p50_source_latency_ms":500,"p95_source_latency_ms":1200,"reviewer_minutes":0,"security_failures":0,"source_count":50,"unaccounted_sources":0,"wall_clock_ms":50000},"mode":"test_only","population":[{"candidate_count":1,"source_id":"synthetic-pilot-source-001","source_receipt_sha256":"2d2763bd8804d0121951fbe72763a2a7a94a7bf1df290f775594689921d8d925","terminal_state":"candidate_ready"},{"candidate_count":2,"source_id":"synthetic-pilot-source-002","source_receipt_sha256":"a2590843d1b5173c95ed249501bc39f9ab38332b26d1c918245b23867a4bacba","terminal_state":"candidate_ready"},{"candidate_count":3,"source_id":"synthetic-pilot-source-003","source_receipt_sha256":"9f8e92046f9bd5d822fbb11de20a4f15f07eed62e849137e115ee24ad3a9722f","terminal_state":"candidate_ready"},{"candidate_count":1,"source_id":"synthetic-pilot-source-004","source_receipt_sha256":"5bc779694ba4a6a93819992abd14422cb69ace0c196811227acd1453e3be4a82","terminal_state":"candidate_ready"},{"candidate_count":2,"source_id":"synthetic-pilot-source-005","source_receipt_sha256":"9f6b5ae0cc66c3d101e191d5b2471faf60e64cc283546e987c7d0466f3464275","terminal_state":"candidate_ready"},{"candidate_count":3,"source_id":"synthetic-pilot-source-006","source_receipt_sha256":"6f2480e3137cb105190f0550a98d7cfd8e88e31413f84fb46234be76055a0959","terminal_state":"candidate_ready"},{"candidate_count":1,"source_id":"synthetic-pilot-source-007","source_receipt_sha256":"886f5e67559f24f4ee594254b3b20bd1b13ec13f95768335ff1aa81826c07029","terminal_state":"candidate_ready"},{"candidate_count":2,"source_id":"synthetic-pilot-source-008","source_receipt_sha256":"838665c576690fa8bd2aab507918acb53550dc284a179cbb81ae5d06114cc291","terminal_state":"candidate_ready"},{"candidate_count":3,"source_id":"synthetic-pilot-source-009","source_receipt_sha256":"02367ad548df5f981fe2f171acdb710f10081537191aa929cf90bf14f48f191d","terminal_state":"candidate_ready"},{"candidate_count":1,"source_id":"synthetic-pilot-source-010","source_receipt_sha256":"69da24642900bb33b4a8301adf4dd1cac4f691ccef402f2da9484d13d67da573","terminal_state":"candidate_ready"},{"candidate_count":2,"source_id":"synthetic-pilot-source-011","source_receipt_sha256":"042d279468aee189b366c6affe329187fb1ed7b5fd4ce3c594baccac822454bf","terminal_state":"candidate_ready"},{"candidate_count":3,"source_id":"synthetic-pilot-source-012","source_receipt_sha256":"2cbe30fc60d155dfd3d32508f87fef3696bdd3baf9c2ea42f91fba135b0cbde7","terminal_state":"candidate_ready"},{"candidate_count":1,"source_id":"synthetic-pilot-source-013","source_receipt_sha256":"35ad22974608956fa856e0e24206cbc644f032b8b3cef50400a5ee79ffe27a9b","terminal_state":"candidate_ready"},{"candidate_count":2,"source_id":"synthetic-pilot-source-014","source_receipt_sha256":"450a24e86aa427a19b1e9f37f2adf138344b45a62345a0c6cfb9a9614b30abbb","terminal_state":"candidate_ready"},{"candidate_count":3,"source_id":"synthetic-pilot-source-015","source_receipt_sha256":"66e64fc49bebb78b79e52166e8bedbd822d4fab74b3c9f1c64a1e75bb7e62326","terminal_state":"candidate_ready"},{"candidate_count":1,"source_id":"synthetic-pilot-source-016","source_receipt_sha256":"797bf12b878b37cd6980cfa149906c99760412ff73e62aa5bf1465f70f0f1ade","terminal_state":"candidate_ready"},{"candidate_count":2,"source_id":"synthetic-pilot-source-017","source_receipt_sha256":"9bb5aa2c81ce1b77fd2577d2f92e61ffe0be32f96734985a85372d0b775053d8","terminal_state":"candidate_ready"},{"candidate_count":3,"source_id":"synthetic-pilot-source-018","source_receipt_sha256":"5c592c1664853bea08e4d6c18537139ce4213e6f610d03f7f44f98258ce57c37","terminal_state":"candidate_ready"},{"candidate_count":1,"source_id":"synthetic-pilot-source-019","source_receipt_sha256":"4dfe07ed8469dd98671bd17919a856f5c35c1fa687a2045f5d65fa32dd3d7784","terminal_state":"candidate_ready"},{"candidate_count":2,"source_id":"synthetic-pilot-source-020","source_receipt_sha256":"e1f71c1ab8ddf374874c5cff941e09205780426b7b7ff32210a4f0e8a39c7c8b","terminal_state":"candidate_ready"},{"candidate_count":3,"source_id":"synthetic-pilot-source-021","source_receipt_sha256":"0b57da165bbce6c4c06f6da0494e19691742d752fc96006e9c2de24838811bf9","terminal_state":"candidate_ready"},{"candidate_count":1,"source_id":"synthetic-pilot-source-022","source_receipt_sha256":"8a36325af964cd86728f6ec965c46dd33254c277b12aa65113502e1b62662827","terminal_state":"candidate_ready"},{"candidate_count":2,"source_id":"synthetic-pilot-source-023","source_receipt_sha256":"41b35fb6bb1c21587033c96fd691a67ca2ca39bb030a542c19165579757c42e7","terminal_state":"candidate_ready"},{"candidate_count":3,"source_id":"synthetic-pilot-source-024","source_receipt_sha256":"4e967dc90028d0e765a9c263b2e9d1ee56284a862e8c747ae24d3a992580bd4f","terminal_state":"candidate_ready"},{"candidate_count":1,"source_id":"synthetic-pilot-source-025","source_receipt_sha256":"31b93fdef5ce00f577104465bc5940f0da04d77c868cb026d549f55a081cf217","terminal_state":"candidate_ready"},{"candidate_count":2,"source_id":"synthetic-pilot-source-026","source_receipt_sha256":"d674efc73a9f5a7469ffb4d51dd47dad7a079a099ad66ccb633c0064a911205f","terminal_state":"candidate_ready"},{"candidate_count":3,"source_id":"synthetic-pilot-source-027","source_receipt_sha256":"7c261fff72cd9e29ad0c7aada58acd49e4acbf7428e291cc60e5e7b9d98594be","terminal_state":"candidate_ready"},{"candidate_count":1,"source_id":"synthetic-pilot-source-028","source_receipt_sha256":"99f075fe1ba0f9baf685484a55658ea46465d838fd32adb956dd6b609fa228d4","terminal_state":"candidate_ready"},{"candidate_count":2,"source_id":"synthetic-pilot-source-029","source_receipt_sha256":"8d6c863d938011ad26482e65566e30743de7d755cb212c919fdb9f48c4f89a97","terminal_state":"candidate_ready"},{"candidate_count":3,"source_id":"synthetic-pilot-source-030